{
  "artifact_id": "M7-SOLVER-RESULT-3BE86CD2C403869EBAD5CBCD2934FEB5C31F9817F230FC6CD69B5530057F662E",
  "artifact_type": "solver-result",
  "content": {
    "adapter_id": "stdlib-finite-domain-v1",
    "adapter_version": "1.0.0",
    "candidate": {
      "git_head": "bbbbbbbbbbbbbbbbbbbbbbbbbbbbbbbbbbbbbbbb",
      "repository_digest": "CCCCCCCCCCCCCCCCCCCCCCCCCCCCCCCCCCCCCCCCCCCCCCCCCCCCCCCCCCCCCCCC",
      "source_spec_sha256": "050EA855693A9DD43303872934824E4B116A9210CECBD3CAA6F24F9EB9823FF4"
    },
    "context_snapshot_id": "CTX-SNAPSHOT-60806B57F8C2C1B3E8AA059428C0FAD2D1629DD06B4E3A402F476497E4038A2C",
    "contract_id": "M7-SOLVER-CONTRACT-F90276F6098C6B78ACAC8C71A37ED7A8C241B384B28E3F5E699F3C469B514B63",
    "diagnostic_code": null,
    "graph_id": "M6-TASK-GRAPH-023FF10BCD3A37F04D2F347BC7F104143939FFC878CEB8CF35EEF45A186B95D8",
    "lease": {
      "attempt": 1,
      "dispatch_message_id": "M6-MESSAGE-A41C6615FF37D008D0EA0F59EF29FC544AD877C87467989831583583671D76C9",
      "expires_at": "2030-01-01T00:01:00Z",
      "fence": 1,
      "graph_id": "M6-TASK-GRAPH-023FF10BCD3A37F04D2F347BC7F104143939FFC878CEB8CF35EEF45A186B95D8",
      "host_id": "HST-M7-TEST",
      "idempotency_key": "IDEM-4E06B097A25C56DFD13506C4FA5C75F48F987288BC68E5DE20A3CFBD59F008C8",
      "lease_id": "M6-LEASE-474A1CAFF5FE7DCDC7682EA30C18F0D40206A73F3186C155A7333E0C77F65299",
      "reserved_solver_calls": 1,
      "reserved_solver_steps": 32,
      "task_id": "TSK-M6-DEMO"
    },
    "license_expression": "Apache-2.0",
    "objective_interval": {
      "lower": 2,
      "upper": 2
    },
    "objective_value": 2,
    "proof_disposition": "exhaustive-enumeration",
    "provenance": [
      {
        "path": "LICENSE",
        "sha256": "C71D239DF91726FC519C6EB72D318EC65820627232B2F796219E87DCF35D0AB4"
      },
      {
        "path": "pyproject.toml",
        "sha256": "331FAA893C0BD615999012489EC59C45C693C42219FF65A865C50186CC84BCC2"
      }
    ],
    "request": {
      "path": "examples/m7-solver/solver-request.json",
      "sha256": "1C1E75B85040D7F0ED2678C65360A0951E4F9517729DF55D00E3634EC5F15C61"
    },
    "request_id": "M7-SOLVER-REQUEST-539AB6FEF40B520EFE79D72FD920360EB4C7478DDD0B9116B4C9D3E9279D2190",
    "resources": {
      "constraint_checks": 16,
      "elapsed_milliseconds": 0,
      "search_space_size": 16,
      "solver_calls": 1,
      "solver_steps": 16,
      "step_limit": 16,
      "termination_reason": "search-exhausted",
      "timeout_milliseconds": null,
      "unvisited_assignments": 0,
      "visited_assignments": 16
    },
    "sensitivity": "public",
    "status": "optimal",
    "task_id": "TSK-M6-DEMO",
    "tolerance": {
      "absolute": 0,
      "kind": "exact",
      "relative": 0
    },
    "witness": {
      "assignments": [
        {
          "value": 0,
          "variable_id": "START_A"
        },
        {
          "value": 2,
          "variable_id": "START_B"
        }
      ]
    }
  },
  "schema_version": "1.0"
}
